{"task_id":"jacobian/rational-pole-vieta-audit","conclusion":"FLAGGED_POLE_STEP_INVALID_REPAIRED_SUM","result":{"denominator_coefficients":[24,0,-50,0,35,0,-10,0,1],"combined_numerator_coefficients":[-96,0,150,0,-70,0,10],"cleared_polynomial_coefficients":[0,-48240,-50,100500,70,-70350,-30,20100,4,-2010],"pole_square_residuals":[{"k":1,"residual":-6},{"k":2,"residual":4},{"k":3,"residual":-6},{"k":4,"residual":24}],"root_sum":"2/1005","diagnosis":"POLES_ARE_PLUS_MINUS_SQUARE_ROOTS_NOT_DENOMINATOR_PARAMETERS"},"claimed_assurance":"COMPUTED","scope":"rational-pole-vieta-audit exact symbolic elimination","completeness":"COMPLETE","evidence":[{"path":"evidence/pole-vieta-certificate.json","sha256":"sha256:27068c8016f14b88201e7e204e2b15e61e7ab7317b0083f8380267610a7e70cd"}],"limitations":["Exact algebra over Q only; no proof-assistant or analytic root isolation claim."]}
